"cie10","descripcion"
"S448","Traumatismo De Otros Nervios A Nivel Del Hombro Y Del Brazo"
"S449","Traumatismo De Nervio No Especificado A Nivel Del Hombro Y Del Brazo"
"S450","Traumatismo De La Arteria Axilar"
"S451","Traumatismo De La Arteria Braquial"
"S452","Traumatismo De La Vena Axilar O Braquial"
"S453","Traumatismo De Vena Superficial A Nivel Del Hombro Y Del Brazo"
"S457","Traumatismo De Multiples Vasos Sanguineos A Nivel Del Hombro Y Del Brazo"
"S458","Traumatismo De Otros Vasos Sanguineos A Nivel Del Hombro Y Del Brazo"
"S459","Traumatismo De Vaso Sanguineo No Especificado A Nivel Del Hombro Y Del Brazo"
"S460","Traumatismo Del Musculo(S)Y  Tendon(Es) Del Manguito Rotatorio Del Hombro"
"S461","Traumatismo Del Tendon Y Musculo De La Cabeza Larga Del Biceps"
"S462","Traumatismo Del Tendon Y Musculo De Otras Partes Del Biceps"
"S463","Traumatismo Del Tendon Y Musculo Del Triceps"
"S467","Traumatismo De Multiples Tendones Y Musculos A Nivel Del Hombro Y Del Brazo"
"S468","Traumatismo De Otros Tendones Y Musculos A Nivel Del Hombro Y Del Brazo"
"S469","Traumatismo De Tendon Y Musculo No Especificado; A Nivel Del Hombro Y Del Brazo"
"S47X","Traumatismo Por Aplastamiento Del Hombro Y Del Brazo"
"S480","Amputacion Traumatica En La Articulacion Del Hombro"
"S481","Amputacion Traumatica A Nivel Entre El Hombro Y El Codo"
"S489","Amputacion Traumatica Del Hombro Y Del Brazo; Nivel No Especificado"
"S497","Traumatismos Multiples Del Hombro Y Del Brazo"
"S498","Otros Traumatismos Especificados Del Hombro Y Del Brazo"
"S499","Traumatismos No Especificados Del Hombro Y Del Brazo"
"S500","Contusion Del Codo"
"S501","Contusion De Otras Partes Del Antebrazo Y De Las No Especificadas"
"S507","Traumatismos Superficiales Multiples Del Antebrazo"
"S508","Otros Traumatismos Superficiales Del Antebrazo"
"S509","Traumatismo Superficial Del Antebrazo; No Especificado"
"S510","Herida Del Codo"
"S517","Heridas Multiples Del Antebrazo"
"S518","Herida De Otras Partes Del Antebrazo"
"S519","Herida Del Antebrazo; Parte No Especificada"
"S520","Fractura De La Epifisis Superior Del Cubito"
"S521","Fractura De La Epifisis Superior Del Radio"
"S522","Fractura De La Diafisis Del Cubito"
"S523","Fractura De La Diafisis Del Radio"
"S524","Fractura De La Diafisis Del Cubito Y Del Radio"
"S525","Fractura De La Epifisis Inferior Del Radio"
"S526","Fractura De La Epifisis Inferior Del Cubito Y Del Radio"
"S527","Fracturas Multiples Del Antebrazo"
"S528","Fractura De Otras Partes Del Antebrazo"
"S529","Fractura Del Antebrazo; Parte No Especificada"
"S530","Luxacion De La Cabeza Del Radio"
"S531","Luxacion Del Codo; No Especificada"
"S532","Ruptura Traumatica Del Ligamento Lateral Del Radio"
"S533","Ruptura Traumatica Del Ligamento Lateral Del Cubito"
"S534","Esguinces Y Torceduras Del Codo"
"S540","Traumatismo Del Nervio Cubital A Nivel Del Antebrazo"
"S541","Traumatismo Del Nervio Mediano A Nivel Del Antebrazo"
"S542","Traumatismo Del Nervio Radial A Nivel Del Antebrazo"
"S543","Traumatismo Del Nervio Sensorial Cutaneo A Nivel Del Antebrazo"
"S547","Traumatismo De Multiples Nervios A Nivel Del Antebrazo"
"S548","Traumatismo De Otros Nervios A Nivel Del Antebrazo"
"S549","Traumatismo De Nervio No Especificado A Nivel Del Antebrazo"
"S550","Traumatismo De La Arteria Cubital A Nivel Del Antebrazo"
"S551","Traumatismo De La Arteria Radial A Nivel Del Antebrazo"
"S552","Traumatismo De Vena A Nivel Del Antebrazo"
"S557","Traumatismo De Multiples Vasos Sanguineos A Nivel Del Antebrazo"
"S558","Traumatismo De Otros Vasos Sanguineos A Nivel Del Antebrazo"
"S559","Traumatismo De Vaso Sanguineo No Especificado A Nivel Del Antebrazo"
"S560","Traumatismo Del Tendon Y Musculo Flexor Del Pulgar A Nivel Del Antebrazo"
"S561","Traumatismo Del Tendon Y Musculo Flexor De Otro(S) Dedo(S) A Nivel Del Antebrazo"
"S562","Traumatismo De Otro Tendon Y Musculo Flexor A Nivel Del Antebrazo"
"S563","Traumatismo De Tendones Y Musculos Abductores Y Extensores Del Pulgar A Nivel Del Antebrazo"
"S564","Traumatismo Del Tendon Y Musculo Extensor De Otro(S) Dedo(S) A Nivel Del Antebrazo"
"S565","Traumatismo De Otro Tendon Y Musculo Extensor A Nivel Del Antebrazo"
"S567","Traumatismo De Multiples Tendones Y Musculos A Nivel Del Antebrazo"
"S568","Traumatismo De Otros Tendones Y Musculos Y De Los No Especificados; A Nivel Del Antebrazo"
"S570","Traumatismo Por Aplastamiento Del Codo"
"S578","Traumatismo Por Aplastamiento De Otras Partes Del Antebrazo"
"S579","Traumatismo Por Aplastamiento Del Antebrazo; Parte No Especificada"
"S580","Amputacion Traumatica A Nivel Del Codo"
"S581","Amputacion Traumatica Nivel Entre El Codo Y La Muneca"
"S589","Amputacion Traumatica Del Antebrazo; Nivel No Especificado"
"S597","Otros Traumatismos Multiples Del Antebrazo"
"S598","Otros Traumatismos Especificados Del Antebrazo"
"S599","Traumatismo No Especificado Del Antebrazo"
"S600","Contusion De Dedo(S) De La Mano; Sin Dano De La(S) Una(S)"
"S601","Contusion De Dedo(S) De La Mano Con Dano De La(S) Una(S)"
"S602","Contusion De Otras Partes De La Muneca Y De La Mano"
"S607","Traumatismos Superficiales Multiples De La Muneca Y De La Mano"
"S608","Otros Traumatismos Superficiales De La Muneca Y De La Mano"
"S609","Traumatismo Superficial De La Muneca Y De La Mano; No Especificado"
"S610","Herida De Dedo(S) De La Mano; Sin Dano De La(S) Una(S)"
"S611","Herida De Dedo(S) De La Mano; Con Dano De La(S) Una(S)"
"S617","Heridas Multiples De La Muneca Y De La Mano"
"S618","Herida De Otras Partes De La Muneca Y De La Mano"
"S619","Herida De La Muneca Y De La Mano; Parte No Especificada"
"S620","Fractura Del Hueso Escafoides [Navicular] De La Mano"
"S621","Fractura De Otro(S) Hueso(S) Del Carpo"
"S622","Fractura Del Primer Metacarpiano"
"S623","Fractura De Otros Huesos Metacarpianos"
"S624","Fracturas Multiples De Huesos Metacarpianos"
"S625","Fractura Del Pulgar"
"S626","Fractura De Otro Dedo De La Mano"
"S627","Fracturas Multiples De Los Dedos De La Mano"
"S628","Fractura De Otras Partes Y De Las No Especificadas De La Muneca Y De La Mano"
"S630","Luxacion De La Muneca"
"S631","Luxacion De Dedos De La Mano"
"S632","Luxaciones Multiples De Dedos De La Mano"
"S633","Ruptura Traumatica De Ligamentos De La Muneca Y Del Carpo"
"S634","Ruptura Traumatica De Ligamentos Del Dedo De La Mano En La(S) Articulacion(Es) Metacarpofalangica E "
"S635","Esguince Y Torcedura De La Muneca"
"S636","Esguinces Y Torceduras De Dedo(S) De La Mano"
"S637","Esguinces Y Torceduras De Otras Partes Y De Las No Especificadas De La Muneca Y De La Mano"
"S640","Traumatismo Del Nervio Cubital A Nivel De La Muneca Y De La Mano"
"S641","Traumatismo Del Nervio Mediano A Nivel De La Muneca Y De La Mano"
"S642","Traumatismo Del Nervio Radial A Nivel De La Muneca Y De La Mano"
"S643","Traumatismo Del Nervio Digital Del Pulgar"
"S644","Traumatismo Del Nervio Digital De Otro Dedo"
"S647","Traumatismo De Multiples Nervios A Nivel De La Muneca Y De La Mano"
"S648","Traumatismo De Otros Nervios A Nivel De La Muneca Y De La Mano"
"S649","Traumatismo De Nervio No Especificado A Nivel De La Muneca Y De La Mano"
"S650","Traumatismo De La Arteria Cubital A Nivel De La Muneca Y De La Mano"
"S651","Traumatismo De La Arteria Radial A Nivel De La Muneca Y De La Mano"
"S652","Traumatismo Del Arco Palmar Superficial"
"S653","Traumatismo Del Arco Palmar Profundo"
"S654","Traumatismo De Vaso(S) Sanguineo(S) Del Pulgar"
"S655","Traumatismo De Vaso(S) Sanguineo(S) De Otro Dedo"
"S657","Traumatismo De Multiples Vasos Sanguineos A Nivel De La Muneca Y De La Mano"
"S658","Traumatismo De Otros Vasos Sanguineos A Nivel De La Muneca Y De La Mano"
"S659","Traumatismo De Vaso Sanguineo No Especificado; A Nivel De La Muneca Y De La Mano"
"S660","Traumatismo Del Tendon Y Musculo Flexor Largo Del Pulgar A Nivel De La Muneca Y De La Mano"
"S661","Traumatismo Del Tendon Y Musculo Flexor De Otro Dedo A Nivel De La Muneca Y De La Mano"
"S662","Traumatismo Del Tendon Y Musculo Extensor Del Pulgar A Nivel De La Muneca Y De La Mano"
"S663","Traumatismo Del Tendon Y Musculo Extensor De Otro(S) Dedo(S) A Nivel De La Muneca Y De La Mano"
"S664","Traumatismo Del Musculo Y Tendon Intrinseco Del Pulgar A Nivel De La Muneca Y De La Mano"
"S665","Traumatismo Del Musculo Y Tendon Intrinseco De Otro(S) Dedo(S) A Nivel De La Muneca Y De La Mano"
"S666","Traumatismo De Multiples Tendones Y Musculos Flexores A Nivel De La Muneca Y De La Mano"
"S667","Traumatismo De Multiples Tendones Y Musculos Extensores A Nivel De La Muneca Y De La Mano"
"S668","Traumatismo De Otros Tendones Y Musculos A Nivel De La Muneca Y De La Mano"
"S669","Traumatismo De Tendon Y Musculo No Especificado; A Nivel De La Muneca Y De La Mano"
"S670","Traumatismo Por Aplastamiento Del Pulgar Y Otro(S) Dedo(S)"
"S678","Traumatismo Por Aplastamiento De Otras Partes Y De Las No Especificadas De La Muneca Y De La Mano"
"S680","Amputacion Traumatica Del Pulgar (Completa) (Parcial)"
"S681","Amputacion Traumatica De Otro Dedo Unico (Completa) (Parcial)"
"S682","Amputacion Traumatica De Dos O Mas Dedos Solamente (Completa) (Parcial)"
"S683","Amputacion Traumatica Combinada (De Parte) De Dedo(S) Con Otras Partes De La Muneca Y De La Mano"
"S684","Amputacion Traumatica De La Mano A Nivel De La Muneca"
"S688","Amputacion Traumatica De Otras Partes De La Muneca Y De La Mano"
"S689","Amputacion Traumatica De La Muneca Y De La Mano; Nivel No Especificado"
"S697","Otros Traumatismos Multiples De La Muneca Y De La Mano"
"S698","Otros Traumatismos Especificados De La Muneca Y De La Mano"
"S699","Traumatismo No Especificado De La Muneca Y De La Mano"
"S700","Contusion De La Cadera"
"S701","Contusion Del Muslo"
"S707","Traumatismos Superficiales Multiples De La Cadera Y Del Muslo"
"S708","Otros Traumatismos Superficiales De La Cadera Y Del Muslo"
"S709","Traumatismo Superficial De La Cadera Y Del Muslo; No Especificado"
"S710","Herida De La Cadera"
"S711","Herida Del Muslo"
"S717","Heridas Multiples De La Cadera Y Del Muslo"
"S718","Herida De Otras Partes Y De Las No Especificadas De La Cintura Pelvica"
"S720","Fractura Del Cuello De Femur"
"S721","Fractura Pertrocanteriana"
"S722","Fractura Subtrocanteriana"
"S723","Fractura De La Diafisis Del Femur"
"S724","Fractura De La Epifisis Inferior Del Femur"
"S727","Fracturas Multiples Del Femur"
"S728","Fracturas De Otras Partes Del Femur"
"S729","Fractura Del Femur; Parte No Especificada"
"S730","Luxacion De La Cadera"
"S731","Esguinces Y Torceduras De La Cadera"
"S740","Traumatismo Del Nervio Ciatico A Nivel De La Cadera Y Del Muslo"
"S741","Traumatismo Del Nervio Femorocutaneo A Nivel De La Cadera Y Del Muslo"
"S742","Traumatismo Del Nervio Sensorial Cutaneo A Nivel De La Cadera Y Del Muslo"
"S747","Traumatismo De Nervios Multiples A Nivel De La Cadera Y Del Muslo"
"S748","Traumatismo De Otros Nervios A Nivel De La Cadera Y Del Muslo"
"S749","Traumatismo De Nervio No Especificado A Nivel De La Cadera Y Del Muslo"
"S750","Traumatismo De La Arteria Femoral"
"S751","Traumatismo De La Vena Femoral A Nivel De La Cadera Y Del Muslo"
"S752","Traumatismo De La Gran Vena Safena A Nivel De La Cadera Y Del Muslo"
"S757","Traumatismo De Multiples Vasos Sanguineos A Nivel De La Cadera Y Del Muslo"
"S758","Traumatismo De Otros Vasos Sanguineos A Nivel De La Cadera Y Del Muslo"
"S759","Traumatismo De Vaso Sanguineo No Especificado A Nivel De La Cadera Y Del Muslo"
"S760","Traumatismo Del Tendon Y Musculo De La Cadera"
"S761","Traumatismo Del Tendon Y Musculo Cuadriceps"
"S762","Traumatismo Del Tendon Y Musculo Aductor Mayor Del Muslo"
"S763","Traumatismo De Tendon Y Musculo Del Grupo Muscular Posterior A Nivel Del Muslo"
"S764","Traumatismo De Otros Tendones Y Musculos Y Los No Especificados A Nivel Del Muslo"
"S767","Traumatismo De Multiples Tendones Y Musculos A Nivel De La Cadera Y Del Muslo"
"S770","Traumatismo Por Aplastamiento De La Cadera"
"S771","Traumatismo Por Aplastamiento Del Muslo"
"S772","Traumatismo Por Aplastamiento De La Cadera Con El Muslo"
"S780","Amputacion Traumatica De La Articulacion De La Cadera"
"S781","Amputacion Traumatica En Algun Nivel Entre La Cadera Y La Rodilla"
"S789","Amputacion Traumatica De Cadera Y Muslo; Nivel No Especificado"
"S797","Traumatismos Multiples De La Cadera Y Del Muslo"
"S798","Otros Traumatismos Especificados De La Cadera Y Del Muslo"
"S799","Traumatismo No Especificado De La Cadera Y Del Muslo"
"S800","Contusion De La Rodilla"
"S801","Contusion De Otras Partes Y Las No Especificadas De La Pierna"
"S807","Traumatismos Superficiales Multiples De La Pierna"
"S808","Otros Traumatismos Superficiales De La Pierna"
"S809","Traumatismo Superficial De La Pierna; No Especificado"
"S810","Herida De La Rodilla"
"S817","Heridas Multiples De La Pierna"
"S818","Herida De Otras Partes De La Pierna"
"S819","Herida De La Pierna; Parte No Especificada"
"S820","Fractura De La Rotula"
"S821","Fractura De La Epifisis Superior De La Tibia"
"S822","Fractura De La Diafisis De La Tibia"
"S823","Fractura De La Epifisis Inferior De La Tibia"
"S824","Fractura Del Perone Solamente"
"S825","Fractura Del Maleolo Interno"
"S826","Fractura Del Maleolo Externo"
"S827","Fracturas Multiples De La Pierna"
"S828","Fractura De Otras Partes De La Pierna"
"S829","Fractura De La Pierna; Parte No Especificada"
"S830","Luxacion De La Rotula"
"S831","Luxacion De La Rodilla"
"S832","Desgarro De Meniscos; Presente"
"S833","Desgarro Del Cartilago Articular De La Rodilla; Presente"
"S834","Esguinces Y Torceduras Que Comprometen Los Ligamentos Laterales (Externo) (Interno) De La Rodilla"
"S835","Esguinces Y Torceduras Que Comprometen El Ligamento Cruzado (Anterior) (Posterior) De La Rodilla"
"S836","Esguinces Y Torceduras De Otras Partes Y Las No Especificadas De La Rodilla"
"S837","Traumatismo De Estructuras Multiples De La Rodilla"
"S840","Traumatismo Del Nervio Tibial A Nivel De La Pierna"
"S841","Traumatismo Del Nervio Peroneo A Nivel De La Pierna"
"S842","Traumatismo Del Nervio Sensorial Cutaneo A Nivel De La Pierna"
"S847","Traumatismo De Nervios Multiples A Nivel De La Pierna"
"S848","Traumatismo De Otros Nervios A Nivel De La Pierna"
"S849","Traumatismo De Nervio No Especificado A Nivel De La Pierna"
"S850","Traumatismo De La Arteria Poplitea"
"S851","Traumatismo De La Arteria Tibial (Anterior) (Posterior)"
"S852","Traumatismo De La Arteria Peronea"
"S853","Traumatismo De La Gran Vena Safena A Nivel De La Pierna"
"S854","Traumatismo De La Vena Safena Externa A Nivel De La Pierna"
"S855","Traumatismo De La Vena Poplitea"
"S857","Traumatismo De Vasos Sanguineos Multiples A Nivel De La Pierna"
"S858","Traumatismo De Otros Vasos Sanguineos A Nivel De La Pierna"
"S859","Traumatismo De Vaso Sanguineo No Especificado A Nivel De La Pierna"
"S860","Traumatismo Del Tendon De Aquiles"
"S861","Traumatismo De Otro(S) Tendon(Es) Y Musculo(S) Del Grupo Muscular Posterior A Nivel De La Pierna"
"S862","Traumatismo De Tendon(Es) Y Musculo(S) Del Grupo Muscular Anterior A Nivel De La Pierna"
"S863","Traumatismo De Tendon(Es) Y Musculo(S) Del Grupo Muscular Peroneo A Nivel De La Pierna"
"S867","Traumatismo De Multiples Tendones Y Musculos A Nivel De La Pierna"
"S868","Traumatismo De Otros Tendones Y Musculos A Nivel De La Pierna"
"S869","Traumatismo De Tendon Y Musculo No Especificado A Nivel De La Pierna"
"S870","Traumatismo Por Aplastamiento De La Rodilla"
"S878","Traumatismo Por Aplastamiento De Otras Partes Y De Las No Especificadas De La Pierna"
"S880","Amputacion Traumatica A Nivel De La Rodilla"
"S881","Amputacion Traumatica En Algun Nivel Entre La Rodilla Y El Tobillo"
"S889","Amputacion Traumatica De La Pierna; Nivel No Especificado"
"S897","Traumatismos Multiples De La Pierna"
"S898","Otros Traumatismos De La Pierna; Especificados"
"S899","Traumatismo De La Pierna; No Especificado"
"S900","Contusion Del Tobillo"
"S901","Contusion De Dedo(S) Del Pie Sin Dano De La(S) Una(S)"
"S902","Contusion De Dedo(S) Del Pie Con Dano De La(S) Una(S)"
"S903","Contusion De Otras Partes Y De Las No Especificadas Del Pie"
"S907","Traumatismos Superficiales Multiples Del Pie Y Del Tobillo"
"S908","Otros Traumatismos Superficiales Del Pie Y Del Tobillo"
"S909","Traumatismo Superficial Del Pie Y Del Tobillo; No Especificado"
"S910","Herida Del Tobillo"
"S911","Herida De Dedo(S) Del Pie Sin Dano(S) De La(S) Una(S)"
"S912","Herida De Dedo(S) Del Pie Con Dano(S) De La(S) Una(S)"
"S913","Herida De Otras Partes Del Pie"
"S917","Heridas Multiples Del Tobillo Y Del Pie"
"S920","Fractura Del Calcaneo"
"S921","Fractura Del Astragalo"
"S922","Fractura De Otro(S) Hueso(S) Del Tarso"
"S923","Fractura De Hueso Del Metatarso"
"S924","Fractura De Los Huesos Del Dedo Gordo Del Pie"
"S925","Fractura De Los Huesos De Otro(S) Dedo(S) Del Pie"
"S927","Fracturas Multiples Del Pie"
"S929","Fractura Del Pie; No Especificada"
"S930","Luxacion De La Articulacion Del Tobillo"
"S931","Luxacion De Dedo(S) Del Pie"
"S932","Ruptura De Ligamentos A Nivel Del Tobillo Y Del Pie"
"S933","Luxacion De Otros Sitios Y Los No Especificados Del Pie"
"S934","Esguinces Y Torceduras Del Tobillo"
"S935","Esguinces Y Torceduras De Dedo(S) Del Pie"
"S936","Esguinces Y Torceduras De Otros Sitios Y Los No Especificados Del Pie"
"S940","Traumatismo Del Nervio Plantar Externo"
"S941","Traumatismo Del Nervio Plantar Interno"
"S942","Traumatismo Del Nervio Peroneal Profundo A Nivel Del Pie Y Del Tobillo"
"S943","Traumatismo De Nervio Sensorial Cutaneo A Nivel Del Pie Y Del Tobillo"
"S947","Traumatismo De Multiples Nervios A Nivel Del Pie Y Del Tobillo"
"S948","Traumatismo De Otros Nervios A Nivel Del Pie Y Del Tobillo"
"S949","Traumatismo De Nervio No Especificado A Nivel Del Pie Y Del Tobillo"
"S950","Traumatismo De La Arteria Dorsal Del Pie"
"S951","Traumatismo De La Arteria Plantar Del Pie"
"S952","Traumatismo De La Vena Dorsal Del Pie"
"S957","Traumatismo De Multiples Vasos Sanguineos A Nivel Del Pie Y Del Tobillo"
"S958","Traumatismo De Otros Vasos Sanguineos A Nivel Del Pie Y Del Tobillo"
"S959","Traumatismo De Vaso Sanguineo No Especificado A Nivel De Pie Y Del Tobillo"
"S960","Traumatismo Del Tendon Y Musculo Del Flexor Largo Del Dedo A Nivel Del Pie Y Del Tobillo"
"S961","Traumatismo Del Tendon Y Musculo Del Extensor Largo Del (De Los) Dedo(S) A Nivel Del Pie Y Del Tobil"
"S962","Traumatismo De Tendones Y Musculos Intrinsecos A Nivel Del Pie Y Del Tobillo"
"S967","Traumatismo De Multiples Tendones Y Musculos A Nivel Del Pie Y Del Tobillo"
"S968","Traumatismo De Otros Tendones Y Musculos A Nivel Del Pie Y Del Tobillo"
"S969","Traumatismo De Tendones Y Musculos No Especificados A Nivel Del Pie Y Del Tobillo"
"S970","Traumatismo Por Aplastamiento Del Tobillo"
"S971","Traumatismo Por Aplastamiento De Dedo(S) Del Pie"
"S978","Traumatismo Por Aplastamiento De Otras Partes Del Pie Y Del Tobillo"
"S980","Amputacion Traumatica Del Pie A Nivel Del Tobillo"
"S981","Amputacion Traumatica De Un Dedo Del Pie"
"S982","Amputacion Traumatica De Dos A Mas Dedos Del Pie"
"S983","Amputacion Traumatica De Otras Partes Del Pie"
"S984","Amputacion Del Pie; Nivel No Especificado"
"S997","Otros Traumatismos Multiples Del Pie Y Del Tobillo"
"S998","Otros Traumatismos Del Pie Y Del Tobillo; Especificados"
"S999","Traumatismo Del Pie Y Del Tobillo; No Especificado"
"T000","Traumatismos Superficiales Que Afectan La Cabeza Con El Cuello"
"T001","Traumatismos Superficiales Que Afectan El Torax Con El Abdomen; La Region Lumbosacra Y La Pelvis"
"T002","Traumatismos Superficiales Que Afectan Multiples Regiones Del(Os) Miembro(S) Superior(Es)"
"T003","Traumatismos Superficiales Que Afectan Multiples Regiones Del(De Los) Miembro(S) Inferior(Es)"
"T006","Traumatismos Superficiales Que Afectan Multiples Regiones Del (De Los) Miembro(S) Superior(Es) Con M"
"T008","Traumatismos Superficiales Que Afectan Otras Combinaciones De Regiones Del Cuerpo"
"T009","Traumatismos Superficiales Multiples; No Especificados"
"T010","Heridas Que Afectan La Cabeza Con El Cuello"
"T011","Heridas Que Afectan El Torax Con El Abdomen; La Region Lumbosacra Y La Pelvis"
"T012","Heridas Que Afectan Multiples Regiones Del (De Los) Miembro(S) Superior(Es)"
"T013","Heridas Que Afectan Multiples Regiones Del (De Los) Miembro(S) Inferior(Es)"
"T016","Heridas Que Afectan Multiples Regiones Del (De Los) Miembro(S) Superior(Es) Con Miembro(S) Inferior("
"T018","Heridas Que Afectan Otras Combinaciones De Las Regiones Del Cuerpo"
"T019","Heridas Multiples; No Especificadas"
"T020","Fracturas Que Afectan La Cabeza Con El Cuello"
"T021","Fracturas Que Afectan El Torax Con La Region Lumbosacra Y La Pelvis"
"T022","Fracturas Que Afectan Multiples Regiones De Un Miembro Superior"
"T023","Fracturas Que Afectan Multiples Regiones De Un Miembro Inferior"
"T024","Fracturas Que Afectan Multiples Regiones De Ambos Miembros Superiores"
"T025","Fracturas Que Afectan Multiples Regiones De Ambos Miembros Inferiores"
"T026","Fracturas Que Afectan Multiples Regiones De Miembro(S) Superior(Es) Con Miembro(S) Inferior(Es)"
"T027","Fracturas Que Afectan El Torax Con La Region Lumbosacra Y La Pelvis Con Miembro(S)"
"T028","Fracturas Que Afectan Otras Combinaciones De Las Regiones Del Cuerpo"
"T029","Fracturas Multiples; No Especificadas"
"T030","Luxaciones; Torceduras Y Esguinces Que Afectan La Cabeza Con El Cuello"
"T031","Luxaciones; Torceduras Y Esguinces Que Afectan El Torax Con La Region Lumbosacra Y La Pelvis"
"T032","Luxaciones; Torceduras Y Esguinces Que Afectan Multiples Regiones Del (De Los) Miembros(S) Superior("
"T033","Luxaciones; Torceduras Y Esguinces Que Afectan Multiples Regiones Del (De Los) Miembro(S) Inferior(E"
"T034","Luxaciones; Torceduras Esguinces Que Afectan  Multiples Regiones Del (De Los) Miembro(S) Superior(Es"
"T038","Luxaciones; Torceduras Y Esguinces Que Afectan Otras Combinaciones De Regiones Del Cuerpo"
"T039","Luxaciones; Torceduras Y Esguinces Multiples; No Especificados"
"T040","Traumatismos Por Aplastamiento Que Afectan La Cabeza Con El Cuello"
"T041","Traumatismos Por Aplastamiento Que Afectan El Torax Con El Abdomen; La Region Lumbosacra Y La Pelvis"
"T042","Traumatismos Por Aplastamiento Que Afectan Multiples Regiones Del (De Los) Miembro(S) Superior(Es)"
"T043","Traumatismos Por Aplastamiento Que Afectan Multiples Regiones Del (De Los) Miembro(S) Inferior(Es)"
"T044","Traumatismos Por Aplastamiento Que Afecta Multiples Regiones Del (De Los) Miembro(S) Superior(Es) Co"
"T047","Traumatismos Por Aplastamiento Del Torax; Del Abdomen; De La Region Lumbosacra Y De La Pelvis Con Mi"
"T048","Traumatismos Por Aplastamiento Que Afectan Otras Combinaciones De Regiones Del Cuerpo"
"T049","Traumatismos Por Aplastamiento Multiple; No Especificados"
"T050","Amputacion Traumatica De Ambas Manos"
"T051","Amputacion Traumatica De Una Mano Y El Otro Brazo [Cualquier Nivel; Excepto Mano]"
"T052","Amputacion Traumatica De Ambos Brazos [Cualquier Nivel]"
"T053","Amputacion Traumatica De Ambos Pies"
"T054","Amputacion Traumatica De Un Pie Y La Otra Pierna [Cualquier Nivel; Excepto Pie]"
"T055","Amputacion Traumatica De Ambas Piernas [Cualquier Nivel]"
"T056","Amputacion Traumatica De Miembros Superior(Es) E Inferior(Es); Cualquier Combinacion [Cualquier Nive"
"T058","Amputacion Traumatica Que Afecta Otras Combinaciones De Regiones Del Cuerpo"
"T059","Amputaciones Traumaticas Multiples; No Especificadas"
"T060","Traumatismos Del Encefalo Y De Nervios Craneales Con Traumatismo De Nervios Y Medula Espinal A Nivel"
"T061","Traumatismos De Nervios Y Medula Espinal Que Afectan Otras Multiples Regiones Del Cuerpo"
"T062","Traumatismos De Nervios Que Afectan Multiples Regiones Del Cuerpo"
"T063","Traumatismos De Vasos Sanguineos Que Afectan Multiples Regiones Del Cuerpo"
"T064","Traumatismos De Tendones Y Musculos Que Afectan Multiples Regiones Del Cuerpo"
"T065","Traumatismos De Organos Intratoracicos Con Organos Intraabdominales Y Pelvicos"
"T068","Otros Traumatismos Especificados Que Afectan Multiples Regiones Del Cuerpo"
"T07X","Traumatismos Multiples; No Especificados"
"T08X","Fractura De La Columna Vertebral; Nivel No Especificado"
"T090","Traumatismo Superficial Del Tronco; Nivel No Especificado"
"T091","Herida Del Tronco; Nivel No Especificado"
"T092","Luxacion; Esguince O Torcedura De Articulacion Y Ligamentos Del Tronco; No Especificado"
"T093","Traumatismo De La Medula Espinal; Nivel No Especificado"
"T094","Traumatismo De Nervios; Raiz De Nervio Espinal Y Plexos Del Tronco No Especificados"
"T095","Traumatismo De Tendones Y Musculos Del Tronco No Especificados"
"T096","Amputacion Traumatica Del Tronco; Nivel No Especificado"
"T098","Otros Traumatismos Especificados Del Tronco; Nivel No Especificado"
"T099","Traumatismo No Especificado Del Tronco; Nivel No Especificado"
"T10X","Fractura De Miembro Superior; Nivel No Especificado"
"T110","Traumatismo Superficial De Miembro Superior; Nivel No Especificado"
"T111","Herida De Miembro Superior; Nivel No Especificado"
"T112","Luxacion; Esguince O Torcedura De Articulacion O Ligamento No Especificado De Miembro Superior; Nive"
"T113","Traumatismo De Nervio No Especificado De Miembro Superior; Nivel No Especificado"
"T114","Traumatismo De Vasos Sanguineos No Especificados De Miembro Superior; Nivel No Especificado"
"T115","Traumatismo De Tendon Y Musculo No Especificados De Miembro Superior; Nivel No Especificado"
"T116","Amputacion Traumatica De Miembro Superior; Nivel No Especificado"
"T118","Otros Traumatismos Especificados De Miembro Superior; Nivel No Especificado"
"T119","Traumatismo No Especificado De Miembro Superior; Nivel No Especificado"
"T12X","Fractura De Miembro Inferior; Nivel No Especificado"
"T130","Traumatismo Superficial De Miembro Inferior; Nivel No Especificado."
"T131","Herida De Miembro Inferior; Nivel No Especificado"
"T132","Luxacion; Esguince O Torcedura De Articulacion Y Ligamentos No Especificados De Miembro Inferior; Ni"
"T133","Traumatismo De Nervios No Especificados De Miembro Inferior; Nivel No Especificado"
