"cie10","descripcion"
"J959","Trastorno No Especificado Del Sistema Respiratorio; Consecutivo A Procedimientos"
"J960","Insuficiencia Respiratoria Aguda"
"J961","Insuficiencia Respiratoria Cronica"
"J969","Insuficiencia Respiratoria; No Especificada"
"J980","Enfermedades De La Traquea Y De Los Bronquios; No Clasificadas En Otra Parte"
"J981","Colapso Pulmonar"
"J982","Enfisema Intersticial"
"J983","Enfisema Compensatorio"
"J984","Otros Trastornos Del Pulmon"
"J985","Enfermedades Del Mediastino; No Clasificadas En Otra Parte"
"J986","Trastornos Del Diafragma"
"J988","Otros Trastornos Respiratorios Especificados"
"J989","Trastorno Respiratorio; No Especificado"
"J990","Enfermedad Pulmonar Reumatoide"
"J991","Trastornos Respiratorios En Otros Trastornos Difusos Del Tejido Conjuntivo"
"J998","Trastornos Respiratorios En Otras Enfermedades Clasificadas En Otra Parte"
"K000","Anodoncia"
"K001","Dientes Supernumerarios"
"K002","Anomalias Del Tamano Y De La Forma Del Diente"
"K003","Dientes Moteados"
"K004","Alteraciones En La Formacion Dentaria"
"K005","Alteraciones Hereditarias De La Estructura Dentaria; No Clasificadas En Otra Parte"
"K006","Alteraciones En La Erupcion Dentaria"
"K007","Sindrome De La Erupcion Dentaria"
"K008","Otros Trastornos Del Desarrollo De Los Dientes"
"K009","Trastorno Del Desarrollo De Los Dientes; No Especificado"
"K010","Dientes Incluidos"
"K011","Dientes Impactados"
"K020","Caries Limitada Al Esmalte"
"K021","Caries De La Dentina"
"K022","Caries Del Cemento"
"K023","Caries Dentaria Detenida"
"K024","Odontoclasia"
"K025","Caries Con Exposicion Pulpar"
"K028","Otras Caries Dentales"
"K029","Caries Dental; No Especificada"
"K030","Atricion Excesiva De Los Dientes"
"K031","Abrasion De Los Dientes"
"K032","Erosion De Los Dientes"
"K033","Reabsorcion Patologica De Los Dientes"
"K034","Hipercementosis"
"K035","Anquilosis Dental"
"K036","Depositos [Acreciones] En Los Dientes"
"K037","Cambios Posteruptivos Del Color De Los Tejidos Dentales Duros"
"K038","Otras Enfermedades Especificadas De Los Tejidos Duros De Los Dientes"
"K039","Enfermedad No Especificada De Los Tejidos Dentales Duros"
"K040","Pulpitis"
"K041","Necrosis De La Pulpa"
"K042","Degeneracion De La Pulpa"
"K043","Formacion Anormal De Tejido Duro En La Pulpa"
"K044","Periodontitis Apical Aguda Originada En La Pulpa"
"K045","Periodontitis Apical Cronica"
"K046","Absceso Periapical Con Fistula"
"K047","Absceso Periapical Sin Fistula"
"K048","Quiste Radicular"
"K049","Otras Enfermedades Y Las No Especificadas De La Pulpa Y Del Tejido Periapical"
"K050","Gingivitis Aguda"
"K051","Gingivitis Cronica"
"K052","Periodontitis Aguda"
"K053","Periodontitis Cronica"
"K054","Periodontosis"
"K055","Otras Enfermedades Periodontales"
"K056","Enfermedad Del Periodonto; No Especificada"
"K060","Retraccion Gingival"
"K061","Hiperplasia Gingival"
"K062","Lesiones De La Encia Y De La Zona Edentula Asociadas Con Traumatismo"
"K068","Otros Trastornos Especificados De La Encia Y De La Zona Edentula"
"K069","Trastorno No Especificado De La Encia Y De La Zona Edentula"
"K070","Anomalias Evidentes Del Tamano De Los Maxilares"
"K071","Anomalias De La Relacion Maxilobasilar"
"K072","Anomalias De La Relacion Entre Los Arcos Dentarios"
"K073","Anomalias De La Posicion Del Diente"
"K074","Maloclusion De Tipo No Especificado"
"K075","Anomalias Dentofaciales Funcionales"
"K076","Trastornos De La Articulacion Temporomaxilar"
"K078","Otras Anomalias Dentofaciales"
"K079","Anomalia Dentofacial; No Especificada"
"K080","Exfoliacion De Los Dientes Debida A Causas Sistemicas"
"K081","Perdida De Dientes Debida A Accidente; Extraccion O Enfermedad Periodontal Local"
"K082","Atrofia Del Reborde Alveolar Desdentado"
"K083","Raiz Dental Retenida"
"K088","Otras Afecciones Especificadas De Los Dientes Y De Sus Estructuras De Sosten"
"K089","Trastorno De Los Dientes Y De Sus Estruturas De Sosten; No Especificado"
"K090","Quistes Originados Por El Desarrollo De Los Dientes"
"K091","Quistes De Las Fisuras De La Region Oral (No Odontogenicos)"
"K092","Otros Quistes De Los Maxilares"
"K098","Otros Quistes De La Region Bucal; No Clasificados En Otra Parte"
"K099","Quiste De La Region Bucal; Sin Otra Especificacion"
"K100","Trastornos Del Desarrollo De Los Maxilares"
"K101","Granuloma Central De Celulas Gigantes"
"K102","Afecciones Inflamatorias De Los Maxilares"
"K103","Alveolitis Del Maxilar"
"K108","Otras Enfermedades Especificadas De Los Maxilares"
"K109","Enfermedad De Los Maxilares; No Especificada"
"K110","Atrofia De Glandula Salival"
"K111","Hipertrofia De Glandula Salival"
"K112","Sialadenitis"
"K113","Absceso De Glandula Salival"
"K114","Fistula De Glandula Salival"
"K115","Sialolitiasis"
"K116","Mucocele De Glandula Salival"
"K117","Alteraciones De La Secrecion Salival"
"K118","Otras Enfermedades De Las Glandulas Salivales"
"K119","Enfermedad De Glandula Salival; No Especificada"
"K120","Estomatitis Aftosa Recurrente"
"K121","Otras Formas De Estomatitis"
"K122","Celulitis Y Absceso De Boca"
"K123","Mucositis Oral (Ulcerativa)"
"K130","Enfermedades De Los Labios"
"K131","Mordedura Del Labio Y De La Mejilla"
"K132","Leucoplasia Y Otras Alteraciones Del Epitelio Bucal; Incluyendo La Lengua"
"K133","Leucoplasia Pilosa"
"K134","Granuloma Y Lesiones Semejantes De La Mucosa Bucal"
"K135","Fibrosis De La Submucosa Bucal"
"K136","Hiperplasia Irritativa De La Mucosa Bucal"
"K137","Otras Lesiones Y Las No Especificadas De La Mucosa Bucal"
"K140","Glositis"
"K141","Lengua Geografica"
"K142","Glositis Romboidea Mediana"
"K143","Hipertrofia De Las Papilas Linguales"
"K144","Atrofia De Las Papilas Linguales"
"K145","Lengua Plegada"
"K146","Glosodinia"
"K148","Otras Enfermedades De La Lengua"
"K149","Enfermedad De La Lengua; No Especificada"
"K20X","Esofagitis"
"K210","Enfermedad Del Reflujo Gastroesofagico Con Esofagitis"
"K219","Enfermedad Del Reflujo Gastroesofagico Sin Esofagitis"
"K220","Acalasia Del Cardias"
"K221","Ulcera Del Esofago"
"K222","Obstruccion Del Esofago"
"K223","Perforacion Del Esofago"
"K224","Disquinesia Del Esofago"
"K225","Diverticulo Del Esofago; Adquirido"
"K226","Sindrome De Laceracion Y Hemorragia Gastroesofagicas"
"K227","Esofago De Barrett"
"K228","Otras Enfermedades Especificadas Del Esofago"
"K229","Enfermedad Del Esofago; No Especificada"
"K230","Esofagitis Tuberculosa"
"K231","Megaesofago En La Enfermedad De Chagas"
"K238","Trastornos Del Esofago En Otras Enfermedades Clasificadas En Otra Parte"
"K250","Ulcera Gastrica; Aguda Con Hemorragia"
"K251","Ulcera Gastrica; Aguda Con Perforacion"
"K252","Ulcera Gastrica; Aguda Con Hemorragia Y Perforacion"
"K253","Ulcera Gastrica; Aguda Sin Hemorragia Ni Perforacion"
"K254","Ulcera Gastrica; Cronica O No Especificada; Con Hemorragia"
"K255","Ulcera Gastrica; Cronica O No Especificada; Con Perforacion"
"K256","Ulcera Gastrica; Cronica O No Especificada; Con Hemorragia Y Perforacion"
"K257","Ulcera Gastrica; Cronica Sin Hemorragia Ni Perforacion"
"K259","Ulcera Gastrica; No Especificada Como Aguda Ni Cronica; Sin Hemorragia Ni Perforacion"
"K260","Ulcera Duodenal; Aguda Con Hemorragia"
"K261","Ulcera Duodenal; Aguda Con Perforacion"
"K262","Ulcera Duodenal; Aguda Con Hemorragia Y Perforacion"
"K263","Ulcera Duodenal; Aguda Sin Hemorragia Ni Perforacion"
"K264","Ulcera Duodenal; Cronica O No Especificada; Con Hemorragia"
"K265","Ulcera Duodenal; Cronica O No Especificada; Con Perforacion"
"K266","Ulcera Duodenal; Cronica O No Especificada; Con Hemorragia Y Perforacion"
"K267","Ulcera Duodenal; Cronica Sin Hemorragia Ni Perforacion"
"K269","Ulcera Duodenal; No Especificada Como Aguda Ni Cronica; Sin Hemorragia Ni Perforacion"
"K270","Ulcera Peptica; De Sitio No Especificado; Aguda Con Hemorragia"
"K271","Ulcera Peptica; De Sitio No Especificado; Aguda Con Perforacion"
"K272","Ulcera Peptica; De Sitio No Especificado; Aguda Con Hemorragia Y Perforacion"
"K273","Ulcera Peptica; De Sitio No Especificado; Aguda Sin Hemorragia Ni Perforacion"
"K274","Ulcera Peptica; De Sitio No Especificado; Cronica O No Especificada; Con Hemorragia"
"K275","Ulcera Peptica; De Sitio No Especificado; Cronica O No Especificada; Con Perforacion"
"K276","Ulcera Peptica; De Sitio No Especificado; Cronica O No Especificada; Con Hemorragia Y Perforacion"
"K277","Ulcera Peptica; De Sitio No Especificado; Cronica Sin  Hemorragia Ni Perforacion"
"K279","Ulcera Peptica; De Sitio No Especificado; No Especificada Como Aguda Ni Cronica; Sin  Hemorragia Ni "
"K280","Ulcera Gastroyeyunal; Aguda Con Hemorragia"
"K281","Ulcera Gastroyeyunal; Aguda Con Perforacion"
"K282","Ulcera Gastroyeyunal; Aguda Con Hemorragia Y Perforacion"
"K283","Ulcera Gastroyeyunal; Aguda Sin Hemorragia Ni Perforacion"
"K284","Ulcera Gastroyeyunal; Cronica O No Especificada; Con Hemorragia"
"K285","Ulcera Gastroyeyunal; Cronica O No Especificada; Con Perforacion"
"K286","Ulcera Gastroyeyunal; Cronica O No Especificada; Con Hemorragia Y Perforacion"
"K287","Ulcera Gastroyeyunal; Cronica Sin Hemorragia Ni Perforacion"
"K289","Ulcera Gastroyeyunal; No Especificada Como Aguda Ni Cronica; Sin Hemorragia Ni Perforacion"
"K290","Gastritis Aguda Hemorragica"
"K291","Otras Gastritis Agudas"
"K292","Gastritis Alcoholica"
"K293","Gastritis Cronica Superficial"
"K294","Gastritis Cronica Atrofica"
"K295","Gastritis Cronica; No Especificada"
"K296","Otras Gastritis"
"K297","Gastritis; No Especificada"
"K298","Duodenitis"
"K299","Gastroduodenitis; No Especificada"
"K30X","Dispepsia Funcional"
"K310","Dilatacion Aguda Del Estomago"
"K311","Estenosis Pilorica Hipertrofica Del Adulto"
"K312","Estrechez O Estenosis Del Estomago En Reloj De Arena"
"K313","Espasmo Del Piloro; No Clasificado En Otra Parte"
"K314","Diverticulo Gastrico"
"K315","Obstruccion Del Duodeno"
"K316","Fistula Del Estomago Y Del Duodeno"
"K317","Polipo Del Estomago Y Del Duodeno"
"K318","Otras Enfermedades Especificadas Del Estomago Y Del Duodeno"
"K319","Enfermedad Del Estomago Y Del Duodeno; No Especificada"
"K350","Apendicitis Aguda Con Peritonitis Generalizada"
"K351","Apendicitis Aguda Con Absceso Peritoneal"
"K352","Apendicitis Aguda Con Peritonitis Generalizada"
"K353","Apendicitis Aguda Con Peritonitis Localizada"
"K358","Otras Apendicitis Agudas; Y Las No Especificadas"
"K359","Apendicitis Aguda; No Especificada"
"K36X","Otros Tipos De Apendicitis"
"K37X","Apendicitis; No Especificada"
"K380","Hiperplasia Del Apendice"
"K381","Concreciones Apendiculares"
"K382","Diverticulo Del Apendice"
"K383","Fistula Del Apendice"
"K388","Otras Enfermedades Especificadas Del Apendice"
"K389","Enfermedad Del Apendice; No Especificada"
"K400","Hernia Inguinal Bilateral Con Obstruccion; Sin Gangrena"
"K401","Hernia Inguinal Bilateral; Con Gangrena"
"K402","Hernia Inguinal Bilateral; Sin Obstruccion Ni Gangrena"
"K403","Hernia Inguinal Unilateral O No Especificada; Con Obstruccion; Sin Gangrena"
"K404","Hernia Inguinal Unilateral O No Especificada; Con Gangrena"
"K409","Hernia Inguinal Unilateral O No Especificada; Sin Obstruccion Ni Gangrena"
"K410","Hernia Femoral Bilateral; Con Obstruccion; Sin Gangrena"
"K411","Hernia Femoral Bilateral; Con Gangrena"
"K412","Hernia Femoral Bilateral; Sin Obstruccion Ni Gangrena"
"K413","Hernia Femoral Unilateral O No Especificada; Con Obstruccion; Sin Gangrena"
"K414","Hernia Femoral Unilateral O No Especificada; Con Gangrena"
"K419","Hernia Femoral Unilateral O No Especificada; Sin Obstruccion Ni Gangrena"
"K420","Hernia Umbilical Con Obstruccion; Sin Gangrena"
"K421","Hernia Umbilical Con Gangrena"
"K429","Hernia Umbilical Sin Obstruccion Ni Gangrena"
"K430","Hernia Insicional Con Obstruccion; Sin Gangrena"
"K431","Hernia Incisional Con Gangrena"
"K432","Hernia Incisional Sin Obstruccion O Gangrena"
"K433","Hernia Paraestomal Con Obstruccion; Sin Gangrena"
"K434","Hernia Paraestomal Con Gangrena"
"K435","Hernia Paraestomal Sin Obstruccion O Gangrena"
"K436","Otras Hernias Ventrales Y Las No Especificadas Con Obstruccion; Sin Gangrena"
"K437","Otras Hernias Ventrales Y Las No Especificadas Con Gangrena"
"K439","Otras Hernias Ventrales Y Las No Especificadas Sin Obstruccion O Gangrena"
"K440","Hernia Diafragmatica Con Obstruccion; Sin Gangrena"
"K441","Hernia Diafragmatica Con Gangrena"
"K449","Hernia Diafragmatica Sin Obstruccion Ni Gangrena"
"K450","Otras Hernias De La Cavidad Abdominal Especificadas; Con Obstruccion; Sin Gangrena"
"K451","Otras Hernias De La Cavidad Abdominal Especificadas; Con Gangrena"
"K458","Otras Hernias De La Cavidad Abdominal Especificadas; Sin Obstruccion Ni Gangrena"
"K460","Hernia Abdominal No Especificada; Con Obstruccion; Sin Gangrena"
"K461","Hernia Abdominal No Especificada; Con Gangrena"
"K469","Hernia Abdominal No Especificada; Sin Obstruccion Ni Gangrena"
"K500","Enfermedad De Crohn Del Intestino Delgado"
"K501","Enfermedad De Crohn Del Intestino Grueso"
"K508","Otros Tipos De Enfermedad De Crohn"
"K509","Enfermedad De Crohn; No Especificada"
"K510","Pancolitis Ulcerativa (Cronica)"
"K511","Ileocolitis (Cronica) Ulcerativa"
"K512","Proctitis (Cronica) Ulcerativa"
"K513","Rectosigmoiditis (Cronica) Ulcerativa"
"K514","Polipos Inflamatorios"
"K515","Colitis Del Lado Izquierdo"
"K518","Otras Colitis Ulcerativas"
"K519","Colitis Ulcerativa; Sin Otra Especificacion"
"K520","Colitis Y Gastroenteritis Debidas A Radiacion"
"K521","Colitis Y Gastroenteritis Toxicas"
"K522","Colitis Y Gastroenteritis Alergicas Y Dieteticas"
"K523","Colitis De Etiologia Indeterminada"
"K528","Otras Colitis Y Gastroenteritis No Infecciosas Especificadas"
"K529","Colitis Y Gastroenteritis No Infecciosas; No Especificadas"
"K550","Trastorno Vascular Agudo De Los Intestinos"
"K551","Trastorno Vascular Cronico Del Intestino"
"K552","Angiodisplasia Del Colon"
"K558","Otros Trastornos Vasculares Del Intestino"
"K559","Trastorno Vascular Del Intestino; No Especificado"
"K560","Ileo Paralitico"
"K561","Invaginacion"
"K562","Volvulo"
"K563","Ileo Por Calculo Biliar"
"K564","Otras Obstrucciones Del Intestino"
"K565","Adherencias [Bridas] Intestinales Con Obstruccion"
"K566","Otras Obstrucciones Intestinales Y Las No Especificadas"
"K567","Ileo; No Especificado"
"K570","Enfermedad Diverticular Del Intestino Delgado Con Perforacion Y Absceso"
"K571","Enfermedad Diverticular Del Intestino Delgado Sin Perforacion Ni Absceso"
"K572","Enfermedad Diverticular Del Intestino Grueso Con Perforacion Y Absceso"
"K573","Enfermedad Diverticular Del Intestino Grueso Sin Perforacion Ni Absceso"
"K574","Enfermedad Diverticular De Ambos Intestinos Con Perforacion Y Absceso"
"K575","Enfermedad Diverticular De Ambos Intestinos; Sin Perforacion Ni Absceso"
"K578","Enfermedad Diverticular Del Intestino; Parte No Especificada; Con Perforacion Y Absceso"
"K579","Enfermedad Diverticular Del Intestino; Parte No Especificada; Sin Perforacion Ni Absceso"
"K580","Sindrome Del Colon Irritable Con Diarrea"
"K589","Sindrome Del Colon Irritable Sin Diarrea"
"K590","Constipacion"
"K591","Diarrea Funcional"
"K592","Intestino Neurogenico; No Clasificado En Otra Parte"
"K593","Megacolon; No Clasificado En Otra Parte"
"K594","Espasmo Anal"
"K598","Otros Trastornos Funcionales Especificados Del Intestino"
"K599","Trastorno Funcional Intestinal; No Especificado"
"K600","Fisura Anal Aguda"
"K601","Fisura Anal Cronica"
"K602","Fisura Anal; No Especificada"
"K603","Fistula Anal"
"K604","Fistula Rectal"
"K605","Fistula Anorrectal"
"K610","Absceso Anal"
"K611","Absceso Rectal"
"K612","Absceso Anorrectal"
"K613","Absceso Isquiorrectal"
"K614","Absceso Intraesfinteriano"
"K620","Polipo Anal"
"K621","Polipo Rectal"
"K622","Prolapso Anal"
"K623","Prolapso Rectal"
"K624","Estenosis Del Ano Y Del Recto"
"K625","Hemorragia Del Ano Y Del Recto"
"K626","Ulcera Del Ano Y Del Recto"
"K627","Proctitis Por Radiacion"
"K628","Otras Enfermedades Especificadas Del Ano Y Del Recto"
"K629","Enfermedad Del Ano Y Del Recto; No Especificada"
"K630","Absceso Del Intestino"
"K631","Perforacion Del Intestino (No Traumatica)"
"K632","Fistula Del Intestino"
"K633","Ulcera Del Intestino"
"K634","Enteroptosis"
"K635","Polipo Del Colon"
"K638","Otras Enfermedades Especificadas Del Intestino"
"K639","Enfermedad Del Intestino; No Especificada"
"K640","Hemorroides De Primer Grado"
"K641","Hemorroides De Segundo Grado"
"K642","Hemorroides De Tercer Grado"
"K643","Hemorroides De Cuarto Grado"
"K644","Marcas Residuales En La Piel; De Hemorroides"
"K645","Trombosis Venosa Perianal"
"K648","Otras Hemorroides Especificadas"
"K649","Hemorroides; Sin Otra Especificacion"
"K650","Peritonitis Aguda"
"K658","Otras Peritonitis"
"K659","Peritonitis; No Especificada"
"K660","Adherencias Peritoneales"
"K661","Hemoperitoneo"
"K668","Otros Trastornos Especificados Del Peritoneo"
"K669","Trastorno Del Peritoneo; No Especificado"
"K670","Peritonitis Por Clamidias"
"K671","Peritonitis Gonococica"
"K672","Peritonitis Sifilitica"
"K673","Peritonitis Tuberculosa"
"K678","Otros Trastornos Del Peritoneo En Enfermedades Infecciosas Clasificadas En Otra Parte"
"K700","Higado Alcoholico Adiposo"
"K701","Hepatitis Alcoholica"
"K702","Fibrosis Y Esclerosis Del Higado; Alcoholica"
"K703","Cirrosis Hepatica Alcoholica"
"K704","Insuficiencia Hepatica Alcoholica"
"K709","Enfermedad Hepatica Alcoholica; No Especificada"
"K710","Enfermedad Toxica Del Higado; Con Colestasis"
"K711","Enfermedad Toxica Del Higado Con Necrosis Hepatica"
"K712","Enfermedad Toxica Del Higado Con Hepatitis Aguda"
"K713","Enfermedad Toxica Del Higado Con Hepatitis Cronica Persistente"
"K714","Enfermedad Toxica Del Higado Con Hepatitis Cronica Lobular"
"K715","Enfermedad Toxica Del Higado Con Hepatitis Cronica Activa"
"K716","Enfermedad Toxica Del Higado Con Hepatitis No Clasificada En Otra Parte"
"K717","Enfermedad Toxica Del Higado Con Cirrosis Y Fibrosis Del Higado"
"K718","Enfermedad Toxica Del Higado Con Otros Trastornos Hepaticos"
"K719","Enfermedad Toxica Del Higado; No Especificada"
"K720","Insuficiencia Hepatica Aguda O Subaguda"
"K721","Insuficiencia Hepatica Cronica"
"K729","Insuficiencia Hepatica; No Especificada"
"K730","Hepatitis Cronica Persistente; No Clasificada En Otra Parte"
"K731","Hepatitis Cronica Lobular; No Clasificada En Otra Parte"
"K732","Hepatitis Cronica Activa; No Clasificada En Otra Parte"
"K738","Otras Hepatitis Cronicas; No Clasificadas En Otra Parte"
"K739","Hepatitis Cronica; No Especificada"
"K740","Fibrosis Hepatica"
"K741","Esclerosis Hepatica"
"K742","Fibrosis Hepatica Con Esclerosis Hepatica"
"K743","Cirrosis Biliar Primaria"
"K744","Cirrosis Biliar Secundaria"
"K745","Cirrosis Biliar; No Especificada"
"K746","Otras Cirrosis Del Higado Y Las No Especificadas"
"K750","Absceso Del Higado"
"K751","Flebitis De La Vena Porta"
"K752","Hepatitis Reactiva No Especificada"
"K753","Hepatitis Granulomatosa; No Clasificada En Otra Parte"
"K754","Hepatitis Autoinmune"
"K758","Otras Enfermedades Inflamatorias Del Higado; Especificadas"
"K759","Enfermedad Inflamatoria Del Higado; No Especificada"
"K760","Degeneracion Grasa Del Higado; No Clasificada En Otra Parte"
"K761","Congestion Pasiva Cronica Del Higado"
"K762","Necrosis Hemorragica Central Del Higado"
"K763","Infarto Del Higado"
"K764","Peliosis Hepatica"
"K765","Enfermedad Veno-Oclusiva Del Higado"
"K766","Hipertension Portal"
"K767","Sindrome Hepatorrenal"
"K768","Otras Enfermedades Especificadas Del Higado"
"K769","Enfermedad Del Higado; No Especificada"
"K770","Trastornos Del Higado En Enfermedades Infecciosas Y Parasitarias Clasificadas En Otra Parte"
"K778","Trastornos Del Higado En Otras Enfermedades Clasificadas En Otra Parte"
"K800","Calculo De La Vesicula Biliar Con Colecistitis Aguda"
"K801","Calculo De La Vesicula Biliar Con Otra Colecistitis"
"K802","Calculo De La Vesicula Biliar Sin Colecistitis"
"K803","Calculo De Conducto Biliar Con Colangitis"
"K804","Calculo De Conducto Biliar Con Colecistitis"
"K805","Calculo De Conducto Biliar Sin Colangitis Ni Colecistitis"
"K808","Otras Colelitiasis"
"K810","Colecistitis Aguda"
"K811","Colecistitis Cronica"
"K818","Otras Colecistitis"
"K819","Colecistitis; No Especificada"
"K820","Obstruccion De La Vesicula Biliar"
"K821","Hidropesia De La Vesicula Biliar"
"K822","Perforacion De La Vesicula Biliar"
"K823","Fistula De La Vesicula Biliar"
"K824","Colesterolosis De La Vesicula Biliar"
"K828","Otras Enfermedades Especificadas De La Vesicula Biliar"
"K829","Enfermedad De La Vesicula Biliar; No Especificada"
"K830","Colangitis"
"K831","Obstruccion Del Conducto Biliar"
"K832","Perforacion Del Conducto Biliar"
"K833","Fistula Del Conducto Biliar"
"K834","Espasmo Del Esfinter De Oddi"
"K835","Quiste Biliar"
"K838","Otras Enfermedades Especificadas De Las Vias Biliares"
"K839","Enfermedad De Las Vias Biliares; No Especificada"
"K850","Pancreatitis Idiopatica Aguda"
"K851","Pancreatitis Biliar Aguda"
"K852","Pancreatitis Aguda Inducida Por Alcohol"
"K853","Pancreatitits Aguda Inducida Por Drogas"
"K858","Otras Pancreatitis Agudas"
"K859","Pancreatitis Aguda; No Especificada"
"K85X","Pancreatitis Aguda"
"K860","Pancreatitis Cronica Inducida Por El Alcohol"
"K861","Otras Pancreatitis Cronicas"
"K862","Quiste Del Pancreas"
"K863","Seudoquiste Del Pancreas"
"K868","Otras Enfermedades Especificadas Del Pancreas"
"K869","Enfermedad Del Pancreas; No Especificada"
"K870","Trastornos De La Vesicula Biliar Y De Las Vias Biliares En Enfermedades Clasificadas En Otra Parte"
"K871","Trastornos Del Pancreas En Enfermedades Clasificadas En Otra Parte"
"K900","Enfermedad Celiaca"
"K901","Esprue Tropical"
"K902","Sindrome Del Asa Ciega; No Clasificado En Otra Parte"
"K903","Esteatorrea Pancreatica"
"K904","Malabsorcion Debida A Intolerancia; No Clasificada En Otra Parte"
"K908","Otros Tipos De Malabsorcion Intestinal"
"K909","Malabsorcion Intestinal; No Especificada"
"K910","Vomito Postcirugia Gastrointestinal"
"K911","Sindromes Consecutivos A La Cirugia Gastrica"
"K912","Malabsorcion Postquirurgica; No Clasificada En Otra Parte"
"K913","Obstruccion Intestinal Postoperatoria"
"K914","Disfuncion De Colostomia O Enterostomia"
"K915","Sindrome De Postcolecistectomia"
"K918","Otros Trastornos Del Sistema Digestivo Consecutivos A Procedimientos; No Clasificados En Otra Parte"
"K919","Trastorno No Especificado Del Sistema Digestivo Consecutivo A Procedimientos"
"K920","Hematemesis"
"K921","Melena"
"K922","Hemorragia Gastrointestinal; No Especificada"
"K928","Otras Enfermedades Especificadas Del Sistema Digestivo"
"K929","Enfermedad Del Sistema Digestivo; No Especificada"
"K930","Trastornos Tuberculosos Del Intestino; Peritoneo Y Ganglios Mesentericos"
"K931","Megacolon En La Enfermedad De Chagas"
"K938","Trastornos De Otros Organos Digestivos Especificados En Enfermedades Clasificadas En Otra Parte"
"L00X","Sindrome Estafilococico De La Piel Escaldada"
"L010","Impetigo [Cualquier Sitio Anatomico] [Cualquier Organismo]"
"L011","Impetiginizacion De Otras Dermatosis"
"L020","Absceso Cutaneo; Furunculo Y Antrax De La Cara"
"L021","Absceso Cutaneo; Furunculo Y Antrax Del Cuello"
"L022","Absceso Cutaneo; Furunculo Y Antrax Del Tronco"
"L023","Absceso Cutaneo; Furunculo Y Antrax De Gluteos"
"L024","Absceso Cutaneo; Furunculo Y Antrax De Miembro"
"L028","Absceso Cutaneo; Furunculo Y Antrax De Otros Sitios"
"L029","Absceso Cutaneo; Furunculo Y Antrax De Sitio No Especificado"
"L030","Celulitis De Los Dedos De La Mano Y Del Pie"
"L031","Celulitis De Otras Partes De Los Miembros"
"L032","Celulitis De La Cara"
"L033","Celulitis Del Tronco"
"L038","Celulitis De Otros Sitios"
"L039","Celulitis De Sitio No Especificado"
"L040","Linfadenitis Aguda De Cara; Cabeza Y Cuello"
"L041","Linfadenitis Aguda Del Tronco"
"L042","Linfadenitis Aguda Del Miembro Superior"
"L043","Linfadenitis Aguda Del Miembro Inferior"
"L048","Linfadenitis Aguda De Otros Sitios"
"L049","Linfadenitis Aguda De Sitio No Especificado"
"L050","Quiste Pilonidal Con Absceso"
"L059","Quiste Pilonidal Sin Absceso"
"L080","Pioderma"
"L081","Eritrasma"
"L088","Otras Infecciones Locales Especificadas De La Piel Y Del Tejido Subcutaneo"
"L089","Infeccion Local De La Piel Y Del Tejido Subcutaneo; No Especificada"
"L100","Penfigo Vulgar"
"L101","Penfigo Vegetante"
"L102","Penfigo Foliaceo"
"L103","Penfigo Brasileno [Fogo Selvagem]"
"L104","Penfigo Eritematoso"
"L105","Penfigo Inducido Por Drogas"
"L108","Otros Penfigos"
"L109","Penfigo; No Especificado"
"L110","Queratosis Folicular Adquirida"
"L111","Dermatosis Acantolitica Transitoria [Grover]"
"L118","Otros Trastornos Acantoliticos Especificados"
"L119","Trastorno Acantolitico; No Especificado"
"L120","Penfigoide Flictenular"
"L121","Penfigoide Cicatricial"
"L122","Enfermedad Flictenular Cronica De La Infancia"
"L123","Epidermolisis Bullosa Adquirida"
"L128","Otros Penfigoides"
"L129","Penfigoide; No Especificado"
"L130","Dermatitis Herpetiforme"
"L131","Dermatitis Pustulosa Subcorneal"
"L138","Otros Trastornos Flictenulares Especificados"
"L139","Trastorno Flictenular; No Especificado"
"L14X","Trastornos Flictenulares En Enfermedades Clasificadas En Otra Parte"
"L200","Prurigo De Besnier"
"L208","Otras Dermatitis Atopicas"
"L209","Dermatitis Atopica; No Especificada"
"L210","Seborrea Capitis"
"L211","Dermatitis Seborreica Infantil"
"L218","Otras Dermatitis Seborreicas"
"L219","Dermatitis Seborreica; No Especificada"
"L22X","Dermatitis Del Panal"
"L230","Dermatitis Alergica De Contacto Debida A Metales"
"L231","Dermatitis Alergica De Contacto Debida A Adhesivos"
"L232","Dermatitis Alergica De Contacto Debida A Cosmeticos"
"L233","Dermatitis Alergica De Contacto Debida A Drogas En Contacto Con La Piel"
"L234","Dermatitis Alergica De Contacto Debida A Colorantes"
"L235","Dermatitis Alergica De Contacto Debida A Otros Productos Quimicos"
"L236","Dermatitis Alergica De Contacto Debida A Alimentos En Contacto Con La Piel"
"L237","Dermatitis Alergica De Contacto Debida A Plantas; Excepto Las Alimenticias"
"L238","Dermatitis Alergica De Contacto Debida A Otros Agentes"
"L239","Dermatitis Alergica De Contacto; De Causa No Especificada"
